{
  "$schema": "https://ontology-dashboard.local/schemas/generator-static-mapping-table.schema.json",
  "mapping_id": "gen-data-canonical-observation",
  "mapping_version": "v1",
  "mapping_sha256": "5808d5a4eec43e4b8e066cba4b29476e58cf8f909ca8e1a40393071c43eb0224",
  "status": "approved",
  "protocol_version": "v2",
  "source_schema_version": "sensor-record-v2",
  "source_schema_fingerprint": "67b7951388d5b463505f7ff0380d5174272db14000e8c91d72374a6edb422810",
  "fingerprint_algorithm_version": "v1",
  "description": "Approved static mapping table for gen_data SensorRecord v2 protocol",
  "field_mappings": [
    {
      "source_field": "voltage",
      "target_field": "voltage",
      "source_type": "float",
      "target_type": "float",
      "required": true,
      "transform": "to_float",
      "unit": "V",
      "timezone": "UTC"
    },
    {
      "source_field": "rotation",
      "target_field": "rotation",
      "source_type": "float",
      "target_type": "float",
      "required": true,
      "transform": "to_float",
      "unit": "rpm",
      "timezone": "UTC"
    }
  ]
}
